21:17:55.834875 IP localhost.50173 > localhost.25000: UDP, length 9551
21:17:55.871429 IP localhost.50173 > localhost.25000: UDP, length 9592
21:17:55.907879 IP localhost.50173 > localhost.25000: UDP, length 9616
21:17:55.944432 IP localhost.50173 > localhost.25000: UDP, length 9567
21:17:55.981033 IP localhost.50173 > localhost.25000: UDP, length 9560
21:17:56.017674 IP localhost.50173 > localhost.25000: UDP, length 9582
21:17:56.054943 IP localhost.50173 > localhost.25000: UDP, length 9617
21:17:56.091978 IP localhost.50173 > localhost.25000: UDP, length 9724
21:17:56.129255 IP localhost.50173 > localhost.25000: UDP, length 9661
21:17:56.166237 IP localhost.50173 > localhost.25000: UDP, length 9701
21:17:56.203292 IP localhost.50173 > localhost.25000: UDP, length 9669
21:17:56.240239 IP localhost.50173 > localhost.25000: UDP, length 9750
21:17:56.277189 IP localhost.50173 > localhost.25000: UDP, length 9684
21:17:56.314217 IP localhost.50173 > localhost.25000: UDP, length 9767
21:17:56.351265 IP localhost.50173 > localhost.25000: UDP, length 9810
21:17:56.388254 IP localhost.50173 > localhost.25000: UDP, length 9757
21:17:56.425219 IP localhost.50173 > localhost.25000: UDP, length 9765
21:17:56.462193 IP localhost.50173 > localhost.25000: UDP, length 9780
21:17:56.499182 IP localhost.50173 > localhost.25000: UDP, length 9808
21:17:56.536272 IP localhost.50173 > localhost.25000: UDP, length 9774
21:17:56.573210 IP localhost.50173 > localhost.25000: UDP, length 9832
21:17:56.610295 IP localhost.50173 > localhost.25000: UDP, length 9798
21:17:56.647185 IP localhost.50173 > localhost.25000: UDP, length 9824
21:17:56.684217 IP localhost.50173 > localhost.25000: UDP, length 9808
21:17:56.721195 IP localhost.50173 > localhost.25000: UDP, length 9785
21:17:56.758195 IP localhost.50173 > localhost.25000: UDP, length 9871
21:17:56.795125 IP localhost.50173 > localhost.25000: UDP, length 9932
21:17:56.832235 IP localhost.50173 > localhost.25000: UDP, length 9904
21:17:56.869312 IP localhost.50173 > localhost.25000: UDP, length 9928
21:17:56.906244 IP localhost.50173 > localhost.25000: UDP, length 9919
21:17:56.943217 IP localhost.50173 > localhost.25000: UDP, length 9977
21:17:56.980200 IP localhost.50173 > localhost.25000: UDP, length 10050
21:17:57.018196 IP localhost.50173 > localhost.25000: UDP, length 9948
21:17:57.055456 IP localhost.50173 > localhost.25000: UDP, length 9949
21:17:57.092459 IP localhost.50173 > localhost.25000: UDP, length 9957
21:17:57.129527 IP localhost.50173 > localhost.25000: UDP, length 9958
21:17:57.166474 IP localhost.50173 > localhost.25000: UDP, length 9850
21:17:57.203514 IP localhost.50173 > localhost.25000: UDP, length 9953
21:17:57.240436 IP localhost.50173 > localhost.25000: UDP, length 9984
21:17:57.277517 IP localhost.50173 > localhost.25000: UDP, length 9997
21:17:57.314659 IP localhost.50173 > localhost.25000: UDP, length 9976
21:17:57.351675 IP localhost.50173 > localhost.25000: UDP, length 10002
21:17:57.388833 IP localhost.50173 > localhost.25000: UDP, length 10024
21:17:57.425863 IP localhost.50173 > localhost.25000: UDP, length 9948
21:17:57.462864 IP localhost.50173 > localhost.25000: UDP, length 10035
21:17:57.500011 IP localhost.50173 > localhost.25000: UDP, length 9980
21:17:57.537072 IP localhost.50173 > localhost.25000: UDP, length 10014
21:17:57.574150 IP localhost.50173 > localhost.25000: UDP, length 10058
21:17:57.611100 IP localhost.50173 > localhost.25000: UDP, length 10122
21:17:57.648133 IP localhost.50173 > localhost.25000: UDP, length 10117
21:17:57.685184 IP localhost.50173 > localhost.25000: UDP, length 10159
21:17:57.722269 IP localhost.50173 > localhost.25000: UDP, length 10220
21:17:57.759218 IP localhost.50173 > localhost.25000: UDP, length 10179
21:17:57.797044 IP localhost.50173 > localhost.25000: UDP, length 10206
21:17:57.834073 IP localhost.50173 > localhost.25000: UDP, length 10136
21:17:57.871144 IP localhost.50173 > localhost.25000: UDP, length 10100
21:17:57.908180 IP localhost.50173 > localhost.25000: UDP, length 10113
21:17:57.945169 IP localhost.50173 > localhost.25000: UDP, length 10114
21:17:57.982345 IP localhost.50173 > localhost.25000: UDP, length 10164
21:17:58.019281 IP localhost.50173 > localhost.25000: UDP, length 10135
21:17:58.056262 IP localhost.50173 > localhost.25000: UDP, length 10099
21:17:58.093309 IP localhost.50173 > localhost.25000: UDP, length 10164
21:17:58.130288 IP localhost.50173 > localhost.25000: UDP, length 10221
21:17:58.167426 IP localhost.50173 > localhost.25000: UDP, length 10203
21:17:58.204863 IP localhost.50173 > localhost.25000: UDP, length 10266
21:17:58.241864 IP localhost.50173 > localhost.25000: UDP, length 10264
21:17:58.279072 IP localhost.50173 > localhost.25000: UDP, length 10252
21:17:58.316064 IP localhost.50173 > localhost.25000: UDP, length 10250
21:17:58.353186 IP localhost.50173 > localhost.25000: UDP, length 10357
21:17:58.390255 IP localhost.50173 > localhost.25000: UDP, length 10365
21:17:58.427221 IP localhost.50173 > localhost.25000: UDP, length 10334
21:17:58.464342 IP localhost.50173 > localhost.25000: UDP, length 10388
21:17:58.501343 IP localhost.50173 > localhost.25000: UDP, length 10392
21:17:58.538366 IP localhost.50173 > localhost.25000: UDP, length 10383
21:17:58.575353 IP localhost.50173 > localhost.25000: UDP, length 10402
21:17:58.612303 IP localhost.50173 > localhost.25000: UDP, length 10397
21:17:58.649293 IP localhost.50173 > localhost.25000: UDP, length 10431
21:17:58.686202 IP localhost.50173 > localhost.25000: UDP, length 10415
21:17:58.723167 IP localhost.50173 > localhost.25000: UDP, length 10401
21:17:58.760203 IP localhost.50173 > localhost.25000: UDP, length 10521
21:17:58.797178 IP localhost.50173 > localhost.25000: UDP, length 10513
21:17:58.834280 IP localhost.50173 > localhost.25000: UDP, length 10531
21:17:58.871320 IP localhost.50173 > localhost.25000: UDP, length 10486
21:17:58.908340 IP localhost.50173 > localhost.25000: UDP, length 10516
21:17:58.945363 IP localhost.50173 > localhost.25000: UDP, length 10528
21:17:58.982428 IP localhost.50173 > localhost.25000: UDP, length 10521
21:17:59.019655 IP localhost.50173 > localhost.25000: UDP, length 10444
21:17:59.056931 IP localhost.50173 > localhost.25000: UDP, length 10518
21:17:59.093944 IP localhost.50173 > localhost.25000: UDP, length 10504
21:17:59.131047 IP localhost.50173 > localhost.25000: UDP, length 10567
21:17:59.168083 IP localhost.50173 > localhost.25000: UDP, length 10593
21:17:59.205237 IP localhost.50173 > localhost.25000: UDP, length 10536
21:17:59.242426 IP localhost.50173 > localhost.25000: UDP, length 10572
21:17:59.279416 IP localhost.50173 > localhost.25000: UDP, length 10605
21:17:59.316403 IP localhost.50173 > localhost.25000: UDP, length 10635
21:17:59.353534 IP localhost.50173 > localhost.25000: UDP, length 10568
21:17:59.390708 IP localhost.50173 > localhost.25000: UDP, length 10527
21:17:59.427732 IP localhost.50173 > localhost.25000: UDP, length 10478
21:17:59.464738 IP localhost.50173 > localhost.25000: UDP, length 10511
21:17:59.501788 IP localhost.50173 > localhost.25000: UDP, length 10515
